{
  "$schema": "../schemas/journey.schema.json",
  "schemaVersion": "1.0",
  "key": "auth.journey.password.registration",
  "name": "Password Registration",
  "summary": "Creates a durable password identity through verified email ownership, complete profile, password establishment, durable-user creation, home-workspace creation, and authenticated session establishment.",
  "version": 1,
  "maturity": "proposed",
  "scenarioKeys": [
    "auth.scenario.password.begin-registration",
    "auth.scenario.password.assert-email",
    "auth.scenario.password.verify-email",
    "auth.scenario.password.complete-profile",
    "auth.scenario.password.establish-credential",
    "auth.scenario.password.create-durable-user",
    "auth.scenario.password.create-home-workspace",
    "auth.scenario.password.establish-session",
    "auth.scenario.password.reused-email-proof-rejected"
  ],
  "entryPredicate": { "expression": "pending-identity-status == none and pending-identity-flow == none and durable-identity == absent" },
  "completionPredicate": { "expression": "pending-identity-status == resolved and pending-identity-flow == none and durable-identity == resolved and email-ownership == verified and profile-completeness == complete and credential-proof == password-proved and home-workspace == established and workspace-membership == home-only and current-workspace == home and session-capability == authenticated-normal" },
  "alternateJourneyKeys": [],
  "sourceReferences": [{ "sourceType": "discussion", "reference": "AUTH-MODEL-GUIDE.md", "section": "4.6" }]
}